{
  "schema": "prototype-1",
  "id": "official.ir.mellat",
  "revision": "ir-1",
  "bank": {
    "id": "ir.mellat",
    "country": "IR",
    "name": "Mellat"
  },
  "templates": [
    {
      "id": "mellat-glued-debit",
      "senders": [
        "Bank Mellat",
        "BankMellat",
        "Mellat",
        "+9815560001",
        "+981000920000",
        "981000920000",
        "1000920000",
        "9815560001",
        "+9830007505",
        "+9820003304",
        "+9820003305",
        "+9830003304",
        "30003305",
        "500092000"
      ],
      "guards": [
        {
          "line": 0,
          "literal": "\u0628\u0631\u062f\u0627\u0634\u062a",
          "excluded": false
        }
      ],
      "outputs": [
        {
          "id": "mellat-movement",
          "region": {
            "line": -1,
            "after": "",
            "before": "",
            "maxLength": 1024
          },
          "kind": "POSTED_MOVEMENT",
          "direction": {
            "fixed": "DEBIT"
          },
          "money": {
            "amount": {
              "line": 0,
              "after": "\u0628\u0631\u062f\u0627\u0634\u062a",
              "before": " \u0645\u0627\u0646\u062f\u0647",
              "maxLength": 32
            },
            "currency": {
              "fixed": "IRR"
            },
            "decimal": ".",
            "group": ",",
            "grouping": "WESTERN",
            "digits": "ASCII_PERSIAN_ARABIC",
            "unitMultiplier": 1
          },
          "accountOptional": true
        },
        {
          "id": "mellat-balance",
          "region": {
            "line": -1,
            "after": "",
            "before": "",
            "maxLength": 1024
          },
          "kind": "BOOKED_BALANCE",
          "money": {
            "amount": {
              "line": 0,
              "after": "\u0645\u0627\u0646\u062f\u0647 ",
              "before": "",
              "maxLength": 32
            },
            "currency": {
              "fixed": "IRR"
            },
            "decimal": ".",
            "group": ",",
            "grouping": "WESTERN",
            "digits": "ASCII_PERSIAN_ARABIC",
            "unitMultiplier": 1
          },
          "accountOptional": true
        }
      ]
    },
    {
      "id": "mellat-delta-balance",
      "senders": [
        "Bank Mellat",
        "BankMellat",
        "Mellat",
        "+9815560001",
        "+981000920000",
        "981000920000",
        "1000920000",
        "9815560001",
        "+9830007505",
        "+9820003304",
        "+9820003305",
        "+9830003304",
        "30003305",
        "500092000"
      ],
      "guards": [
        {
          "line": 0,
          "literal": "\u067e\u0631\u062f\u0627\u062e\u062a \u0627\u0646\u062c\u0627\u0645 \u0634\u062f",
          "excluded": false
        }
      ],
      "outputs": [
        {
          "id": "mellat-delta-balance",
          "region": {
            "line": -1,
            "after": "",
            "before": "",
            "maxLength": 1024
          },
          "kind": "BOOKED_BALANCE",
          "money": {
            "amount": {
              "line": 0,
              "after": "\u0645\u0627\u0646\u062f\u0647 \u062d\u0633\u0627\u0628: ",
              "before": "",
              "maxLength": 32
            },
            "currency": {
              "fixed": "IRR"
            },
            "decimal": ".",
            "group": ",",
            "grouping": "WESTERN",
            "digits": "ASCII_PERSIAN_ARABIC",
            "unitMultiplier": 1
          },
          "accountOptional": true
        }
      ]
    }
  ]
}
