{
  "schema": "prototype-1",
  "id": "official.ir.blu",
  "revision": "ir-1",
  "bank": {
    "id": "ir.blu",
    "country": "IR",
    "name": "Blu"
  },
  "templates": [
    {
      "id": "blu-withdrawal",
      "senders": [
        "Blu",
        "blu",
        "+982187641",
        "98300087641",
        "300087641",
        "989999987641",
        "9999987641",
        "+989999987641",
        "+9890000258"
      ],
      "guards": [
        {
          "line": 0,
          "literal": "\u0628\u0644\u0648",
          "excluded": false
        }
      ],
      "outputs": [
        {
          "id": "blu-withdraw-movement",
          "region": {
            "line": -1,
            "after": "",
            "before": "",
            "maxLength": 1024
          },
          "kind": "POSTED_MOVEMENT",
          "direction": {
            "fixed": "DEBIT"
          },
          "money": {
            "amount": {
              "line": 2,
              "after": "\u0639\u0632\u06cc\u0632\u060c ",
              "before": " \u0631\u06cc\u0627\u0644",
              "maxLength": 32
            },
            "currency": {
              "fixed": "IRR"
            },
            "decimal": ".",
            "group": ",",
            "grouping": "WESTERN",
            "digits": "ASCII_PERSIAN_ARABIC",
            "unitMultiplier": 1
          },
          "accountOptional": true
        },
        {
          "id": "blu-balance",
          "region": {
            "line": -1,
            "after": "",
            "before": "",
            "maxLength": 1024
          },
          "kind": "BOOKED_BALANCE",
          "money": {
            "amount": {
              "line": 3,
              "after": "\u0645\u0648\u062c\u0648\u062f\u06cc: ",
              "before": " \u0631\u06cc\u0627\u0644",
              "maxLength": 32
            },
            "currency": {
              "fixed": "IRR"
            },
            "decimal": ".",
            "group": ",",
            "grouping": "WESTERN",
            "digits": "ASCII_PERSIAN_ARABIC",
            "unitMultiplier": 1
          },
          "accountOptional": true
        }
      ]
    }
  ]
}
